<?xml version="1.0" encoding="utf-8" ?><!DOCTYPE board SYSTEM "board.dtd">
<board state="5">
  <play val="1">
    <result des="HOMERUN over left field fence" event="HR/F7"/>
  </play>
  <play val="9">
    <result des="SINGLE over short; one runner scores; other to second" event="s"/>
    <conditions two_outs="t">
      <result des="SINGLE over short; one runner scores; other to third" event="S7/L6.3-H;1-3"/>
    </conditions>
  </play>
  <play val="12">
    <fielding val="3">
      <conditions infield="c">
        <result des="Safe at first; F.C.; runner out at home; other to second; A-2B PO-C" event="FC4/G4.3XH(42);1-2"/>
      </conditions>
      <conditions infield="d" zero_outs="t">
        <result des="Double play; A-1B PO-SS A-SS PO-1B; runner on third scores" event="36(1)63/GDP/G3"/>
      </conditions>
      <conditions infield="d" zero_outs="f">
        <result des="Double play; A-1B PO-SS A-SS PO-1B" event="36(1)63/GDP/G3"/>
      </conditions>
      <conditions infield="d" two_outs="t">
        <result des="Groundout; A-1B PO-P" event="31/G3"/>
      </conditions>
    </fielding>
    <fielding val="2">
      <conditions infield="c">
        <result des="Safe at first; F.C.; runner out at home; other to second; A-2B PO-C" event="FC4/G4.3XH(42);1-2"/>
      </conditions>
      <conditions infield="d" zero_outs="t">
        <result des="Double play; A-1B PO-SS A-SS PO-1B; runner on third scores" event="36(1)3/GDP/G3.3-H"/>
      </conditions>
      <conditions infield="d" zero_outs="f">
        <result des="Double play; A-1B PO-SS A-SS PO-1B" event="36(1)3/GDP/G3"/>
      </conditions>
      <conditions infield="d" two_outs="t">
        <result des="Groundout; A-1B PO-P" event="31/G3"/>
      </conditions>
    </fielding>
    <fielding val="1">
      <conditions infield="c">
        <result des="Safe at first; F.C.; runner out at home; other to second; A-2B PO-C" event="FC4/G4.3XH(42);1-2"/>
      </conditions>
      <conditions infield="d" zero_outs="t">
        <result des="Double play; A-2B PO-SS A-SS PO-1B; runner on third scores" event="46(1)3/GCP/G4.3-H"/>
      </conditions>
      <conditions infield="d" zero_outs="f">
        <result des="Double play; A-1B PO-SS A-SS PO-1B" event="36(1)3/GDP/G3"/>
      </conditions>
      <conditions infield="d" two_outs="t">
        <result des="Groundout; A-1B PO-P" event="31/G3"/>
      </conditions>
    </fielding>
  </play>
  <play val="21">
    <fielding val="3">
      <conditions two_outs="t">
        <result des="Strikeout; catcher drops third strike; one runner scores; other to second; batter to first; passed ball" event="K+PB.3-H;1-2;B-1"/>
      </conditions>
      <result des="Strikeout; PO-C" event="K"/>
    </fielding>
    <fielding val="2">
      <conditions two_outs="t">
        <result des="Strikeout; catcher drops third strike; batter safe at first, filling the bases; passed ball" event="K+PB;1-2;B-1"/>
      </conditions>
      <result des="Strikeout; PO-C" event="K"/>
    </fielding>
    <fielding val="1">
      <result des="Ball; catcher throws wild to third; one runner scores; other to second; E-C" pitch="B" event="PO3(E2/TH).3-H(NR)(UR)"/>
    </fielding>
  </play>
  <play val="29">
    <fielding val="3">
      <result des="Out at first; runner to second; other holds; A-P PO-1B" event="13/G1.1-2"/>
      <conditions p_sym="x">
        <result des="Strikeout; PO-C" event="K"/>
      </conditions>
    </fielding>
    <fielding val="2">
      <result des="Out at first; runner to second; other holds; A-P PO-1B" event="13/G1.1-2"/>
      <conditions p_sym="x">
        <result des="Strikeout; PO-C" event="K"/>
      </conditions>
    </fielding>
    <fielding val="1">
      <result des="Out at first; runner to second; other holds; A-P PO-1B" event="13/G1.1-2"/>
      <conditions p_sym="x">
        <result des="Strikeout; PO-C" event="K"/>
      </conditions>
    </fielding>
  </play>
  <play val="37">
    <fielding val="3">
      <conditions on_1b_speed="s">
        <result des="Runner on first holds" pitch="K" event=".1-1"/>
      </conditions>
      <result des="Runner on first steals second; other holds third" event="SB2.3-3"/>
    </fielding>
    <fielding val="2">
      <conditions two_outs="t">
        <result des="Runner on first out stealing 2nd; A-C PO-SS" event="CS2(26)"/>
      </conditions>
      <result des="Runner on first out stealing 2nd; A-C PO-SS; other scores" event="CS2(26)"/>
    </fielding>
    <fielding val="1">
      <conditions two_outs="t">
        <result des="Runner on first out stealing 2nd; A-C PO-SS" event="CS2(26)"/>
      </conditions>
      <result des="Runner on first out stealing 2nd; A-C PO-SS; other holds" event="CS2(26)"/>
    </fielding>
  </play>
</board>